Publisher,Headquarters,Est.,Notable games published,Notes,Active
Faster Than Light,UK,1986,Hydrofool,Label of Gargoyle Games. Defunct in 1989.,0
Fathammer,Finland,2002,,Acquired by Telcogames in 2006.,0
Firebird Software,"London, England, UK",1983,Elite,Defunct in 1989 upon MicroProse's acquisition of Telecomsoft.,0
First Star Software,"Chappaqua, New York, United States",1982,Boulder Dash,Acquired by BBG Entertainment in 2018 and their games are now published by BBG Entertainment.,0
Feral Interactive,"London, England, UK",1999,,Publishes Macintosh and Linux games,1
Fill-in-Cafe,Japan,1987,,Known as Team Cross Wonder until 1989. Defunct in 1998.,0
Fisher Price,"East Aurora, New York, United States",1930,Various Atari 8-bit and Colecovision games,Acquired by Mattel in 1993. No longer publishes video games.,0
Fishtank Interactive,"Ravensburg, Germany",2000,AquaNox,Publishing Label of Ravensburger Interactive. Acquired alongside parent by JoWooD Productions in 2002.,0
Flair Software,"Newcastle upon Tyne, UK",1990,Elvira: The Arcade Game,Last game published in 1999.,0
Flight-Plan,"Gifu, Japan",1989,Sacred Blaze,Defunct in 2010.,0
Flying Edge,"Glen Cove, New York, United States",1992,The Simpsons: Bart vs. the Space Mutants,Label of Acclaim Entertainment. Defunct in 1994.,0
Focus Home Interactive,"Paris, France",1996,Pro Cycling Manager,,1
Focus Multimedia,"Rugeley, UK",1995,Various budget CD-ROM games,,1
FormGen,"Scottsdale, Arizona, United States",1987,Space Dude,Acquired by GT Interactive in 1996.,0
The Fourth Dimension,UK,1989,Apocalypse,Also known as The 4th Dimension or 4D. Defunct in 2004.,0
Fox Interactive,"Los Angeles, California, United States",1982,CrocDie Hard Trilogy,Also a video game developer. Acquired by Activision Blizzard.,0
Freeverse Software,"New York City, United States",1994,Project Nomads,Acquired by Ngmoco in 2010.,0
French Bread,"Tokyo, Japan",1998,Glove on Fight,Formerly known as Watanabe Seisakusho.,1
Froggo,"Sunnyvale, California",1987,Various Atari 2600 and 7800 games,Defunct in 1989.,0
FromSoftware,"Tokyo, Japan",1986,Dark Souls,Subsidiary of Kadokawa Corporation,1
Front Wing,Japan,2000,Tea Society of a Witch,,1
FTL Games,"San Diego, California, United States",1982,Dungeon Master,Defunct in 1996.,0
Fujisankei Communications International,"New York, New York, United States",1986,,No longer publishes video games,0
Fujitsu,"Tokyo, Japan",1935,Various FM Towns games,No longer publishes video games.,0
Full On Games,"Tokyo, Japan",1996,Various Dreamcast games,Also known as FOG.,1
Funcom,"Oslo, Norway",1993,Age of Conan,Also a video game developer.,1
Future Games,"Beroun, Czech Republic",1996,The Black Mirror,Defunct in 2011.,0
Fuuki,"Kyoto, Japan",1977,Asura Blade: Sword of Dynasty,No longer publishes video games.,0
G-Collections,"Las Vegas, Nevada",2001,Kana Little Sister,Acquired by JAST USA in 2005; defunct in 2015.,0
G.rev,Japan,2000,Border Down,,1
Gaelco,"Barcelona, Spain",1981,Big Karnak,Dissolved in 2007,0
Gaijinworks,"Redding, California, United States",2006,Miami Law,,1
Gainax,"Tokyo, Japan",1984,Princess Maker,No longer publishes video games.,0
Gakken,"Tokyo, Japan",1947,Might and Magic Book One: The Secret of the Inner Sanctum,No longer publishes video games.,0
Gamecock,"Austin, Texas, United States",2007,,Acquired by SouthPeak Games.,0
Gameloft,"Paris, France",2000,Asphalt Urban GT,,1
Games by Apollo,"Richardson, Texas, United States",1981,Lost Luggage,Defunct in 1983.,0
Games Workshop,"Nottingham, UK",1975,Chaos,Ceased publishing video games in 1985.,0
GameTek,"North Miami Beach, Florida, United States",1987,Wheel of Fortune,Publishing label of IJE. Defunct in 1998.,0
Game Arts,"Tokyo, Japan",1985,Thexder,Acquired by GungHo Online Entertainment in 2005 and their games are now published by GungHo Online Entertainment.,0
The Game Factory,"Aarhus, Denmark",2004,Various licensed Game Boy Advance and Nintendo DS games,Defunct.,0
Game Park,South Korea,1996,Various GP32 games,Defunct in 2007.,0
Game Studio,"Tokyo, Japan",1985,,Defunct in 2015.,0
Gargoyle Games,"Dudley, England, UK",1983,Tir Na Nog,Defunct in 1987.,0
Gathering of Developers,"Austin, Texas, United States",1998,Jazz Jackrabbit 2,Acquired by Take Two Interactive in 2000; renamed to Gathering. Defunct in 2004.,0
Gearbox Software,"Frisco, Texas, United States",1999,Bulletstorm: Full Clip Edition,,1
General Entertainment,"Tokyo, Japan",1994,,Defunct in 2011.,0
Genki,"Tokyo, Japan",1990,Tokyo Xtreme Racer,,1
Ghostlight,"Braintree, Essex, UK",2004,,,0
Global Star Software,"Ontario, Canada",1992,,"Publishing label of Take-Two Interactive, name retired.",0
Gathering of Developers,"Texas, United States",1988,TropicoStronghold,"Acquired by Take-Two Interactive, name retired.",0
Gebelli Software,United States,1982,Various Apple II games,Defunct in 1984.,0
Giga,Japan,1993,Variable Geo,,1
Gizmondo,Sweden,2000,Sticky Balls,Known as Tiger Telematics until 2004. Defunct in 2006.,0
Global A Entertainment,"Tokyo, Japan",1997,"My World, My Way","Renamed to GAE, Inc. in 2009.",1
Global VR,"San Jose, California, United States",1998,EA Sports NASCAR Racing,,1
GN Software,Japan,2003,Ren'ai CHU!,Label of Good Navigate.,0
GOG Ltd,"Warsaw, Poland",2008,,Also a digital distribution service.,1
Gogii Games,"Moncton, New Brunswick, Canada",2006,,Also a video game developer.,1
Gotham Games,"New York City, United States",2002,Conflict: Desert Storm,Label of Take-Two Interactive. Defunct in 2003.,0
Gottlieb,"Chicago, Illinois, United States",1927,Q*bert,Defunct in 1996.,0
Got Game Entertainment,"Weston, Connecticut, United States",2002,ARMA 2,,0
Grandslam Entertainment,"Croydon, Surrey, UK",1987,Reunion,Defunct in 1995.,0
Graphsim Entertainment,"Addison, Texas",1992,Hellcats Over the Pacific,Also known as Graphic Simulations.,1
Gravity,"Seoul, Republic of Korea",2013,Ragnarok OnlineRagnarok Online 2: Legend of the Second,Also a video game developer. Subsidy of GungHo Online Entertainment.,1
Great Wave Software,"Scotts Valley, California, United States",1984,Various edutainment games,Defunct.,0
Gremlin Industries,"San Diego, California, United States",1973,Blockade,Acquired by Bally in 1984.,0
Gremlin Interactive,"Sheffield, England, UK",1984,,"Acquired by Atari, SA n√©e Infogrames, name retired.",0
Grolier Interactive Inc,"New York City, United States",1982,Golden Gate Killer,Known as Grolier Electronic Publishing Inc until 1996. Acquired by Scholasttic in 1999.,0
Groove Games,"Toronto, Ontario, Canada",2001,Pariah,Defunct in 2009.,0
GSC World Publishing,"Kiev, Ukraine",2004,,,0
GTE Interactive Media,"Carlsbad, California, United States",1990,Titanic: Adventure Out of Time,Software publishing arm of GTE. Defunct in 1997.,0
GT Interactive,"New York City, United States",1993,Blood,"Acquired by Atari, SA n√©e Infogrames.",0
GungHo Online Entertainment,"Tokyo, Japan",1998,Ragnarok DS,,1
Gust Co. Ltd.,"Nagano, Japan",1993,,Acquired by Koei Tecmo in 2011 and their games are now published by Koei Tecmo.,0
Hacker International,Japan,1990,Menace Beach,Defunct in 2001.,0
Haikuo Soft,Japan,2001,Yotsunoha,,1
HAL Laboratory,"Tokyo, Japan",1980,Eggerland,No longer publishes video games.,0
Hamster Corporation,"Tokyo, Japan",1999,Shienryu,,1
HanbitSoft,South Korea,1999,StarCraft (KR),Acquired by T3 Entertainment.,1
Hasbro Interactive,"California, United States North Carolina, United States",1995,MonopolyRISKRollerCoaster Tycoon,"Assets acquired by Atari, SA n√©e Infogrames in 2000, no staff retained",0
Hect,Japan,1988,Firestriker,Defunct in 2002.,0
HeR Interactive,"Bellevue, Washington, United States",1995,Nancy Drew,Also a video game developer.,1
Heureka-Klett,Germany,1996,Opera Fatal,Defunct.,0
Hi Tech Expressions,United States,1988,,,0
Hewson Consultants,UK,1981,Pinball Dreams,Defunct in 1991.,0
Hirameki,"Diamond Bar, California, United States",2000,Ever17,Ceased publishing video games in 2008.,0
Hodder & Stoughton,"London, England, UK",1868,The Rats,No longer publishes video games.,0
Home Entertainment Suppliers,"Sydney, Australia",1984,Raid 2020,Also known as HES.,1
Hooksoft,"Tokyo, Japan",2000,Orange Pocket,,1
HopeLab,"Redwood City, California, United States",2001,Re-Mission,,1
Houghton Mifflin Harcourt,"Boston, Massachusetts, United States",1832,Where in the World is Carmen Sandiego? Treasures of Knowledge,"Publishes games through its software division, Houghton Mifflin Harcourt Learning Technology, which was known as Riverdeep PLC until its acquisition of Houghton Mifflin in 2006, and then as Houghton Mifflin Riverdeep Group until 2007.",1
Hudson Soft,"Minato, Tokyo, Japan",1973,BombermanBonkAdventure Island,Also a video game developer. Acquired by Konami.,0
Human Engineered Software,"Brisbane, California, United States",1980,Project Space Station,Acquired by Avant Garde Publishing Corp. in 1984.,0
Human Entertainment,"Tokyo, Japan",1983,Fire Pro Wrestling,Defunct in 2000.,0
Humble Bundle,"San Francisco, California, US",2010,A Hat in Time,Acquired by IGN Entertainment,1
HummingBirdSoft,Japan,1982,Laplace no Ma,Defunct.,0
Humongous Entertainment,"City of Industry, California, United States",1992,Putt-Putt,"Defunct in 2004. Since reestablished, but no longer self-publishes.",0
IBM,"Armonk, New York, United States",1911,Alley Cat,,0
Iceberg Interactive,"Haarlem, The Netherlands",2009,Killing FloorAPB: ReloadedEndless SpaceStarDrive,,1
ICOM Simulations,"Wheeling, Illinois, United States",1981,Sherlock Holmes: Consulting Detective,"Acquired by Viacom New Media in 1993, reformed as Rabid Entertainment in 1997, and closed in 1998.",0
Idea Factory,"Tokyo, Japan",1994,Black Stone: Magic & Steel,,1
id Software,"Richardson, Texas, United States",1991,Heretic,Acquired by ZeniMax Media in 2009.,0
Ignition Entertainment,"Essex, England, UK",2002,,Acquired by The Walt Disney Company,0
Illusion Soft,"Yokohama, Japan",2001,RapeLay,,1
Imageepoch,"Tokyo, Japan",2005,Black Rock Shooter: The Game,Defunct in 2015.,0
Image Works,UK,1988,Bloodwych,Label of Mirrorsoft. Last game published in 1991.,0
Imagic,"California, United States",1981,Various Atari 2600 gamesVarious early consoles games,Also a video game developer.,0
Imagine Software,"Liverpool, England, UK",1982,"Arcadia, Alchemist","Defunct in 1984; rights bought by Ocean Software, which continued to use the Imagine name as a label on some games.",0
Impressions Games,"Cambridge, Massachusetts, United States",1989,Global Domination,Acquired by Sierra in 1995; defunct in 2004.,0
Incentive Software,"Reading, Berkshire, UK",1983,Driller,Reformed as Superscape in 1992.,0
Incredible Technologies,"Vernon Hills, United States",1985,Golden Tee Golf,,1
index+,France,1992,Various adventure games,Merged with France Telecom Multimedia in 2000 to become Wanadoo Edition.,0
indiePub Entertainment,"Cincinnati, Ohio, United States",2008,,,0
Infocom,"Cambridge, Massachusetts, United States",1979,Zork series,"Acquired by Activision, name retired.",0
Infogrames,"Lyon, France, France",1983,,"(Renamed Atari, SA)",0
Innerprise Software,"Hunt Valley, Maryland, United States",1989,Battle Squadron,Defunct in 1992.,0
Inscape,"Los Angeles, United States",1994,Bad Day on the MidwayDrowned God,"Acquired by Graphix Zone in early 1997, which ceased operations in November 1997.",0
Intellivision Productions,United States,1997,Intellivision Lives!,,1
Interactive Magic,"Cary, North Carolina, United States",1994,Capitalism,Changed name to iEntertainment Network in 1999.,1
Interceptor Micros,"Tadley, UK",1982,The Heroes Of Karn,Also a video game developer. Defunct in 1992.,0
Interchannel,"Tokyo, Japan",1931,Marvel: Ultimate Alliance,Subsidiary of NEC until 2004. No longer publishes video games.,0
International Games System,"New Taipei City, Taiwan",1989,Knights of Valour,,1
Interplay Entertainment,"Beverly Hills, California, United States",1983,FalloutDescent,"Also a video game developer. Acquired by Titus Interactive, closed and reopened as an independent publisher.",1
Introversion Software,"Walton-on-Thames, UK",2001,Uplink,,1
INTV Corporation,United States,1984,Various Intellivision games,Defunct in 1990.,0
inXile Entertainment,"Newport Beach, California, United States",2002,,Also a video game developer; acquired by Microsoft in 2018.,1
iQue,"Suzhou, China",2002,Various iQue games,Joint venture between Wei Yen and Nintendo.,1
Irem,"Tokyo, Japan",1997,,Also a video game developer. Dissolved video game subsidiary in 2011.,0
ITE Media,"Copenhagen, Denmark",1998,Hugo,Software publishing arm of Interactive Television Entertainment. Acquired by NDS Group in 2006; defunct in 2010.,0
J.K. Greye Software,"Bath, England, UK",1981,3D Monster Maze,Reformed as J.K. Greye Enterprises Ltd in 1983.,0
Jaleco,Japan,1974,,Also a video game developer.,0
JAST USA,"San Diego, California, United States",1996,Season of the Sakura,,1
Jester Interactive,"Wales, UK",1997,Suzuki TT Superbikes,,1
Johnson & Johnson,"New Brunswick, New Jersey, United States",1886,Tooth Protectors,No longer publishes video games.,0
JoWooD Productions,"Liezen, Austria",1995,,Folded into Nordic Games in 2011.,0
JumpStart Games (formerly Knowledge Adventure),"Los Angeles, California, United States",1989,Undersea Adventure,Acquired by NetDragon Websoft.,1
K2 Network (Gamersfirst),"Irvine, California, United States",2001,War RockSword 2APB: ReloadedKnight OnlineFallen Earth,Merged with Reloaded Games,1
Kalisto Entertainment,"Bordeaux, France",1990,S.C.OUT,"Label of Atreid Concept until 1996, when it became the name of the company as a whole. Defunct in 2002.",0
Kalypso Media,"Worms, Germany",2006,Imperium Romanum,,1
Kaneko,"Tokyo, Japan",1980,,,0
Kaypro,"San Diego, California, United States",1981,Ladder,Defunct in 1992; reestablished in 1999; defunct again in 2001.,0
Kemco,Japan,1984,Top Gear,Also a video game developer.,1
King Games,"Miami, Florida",2006,Sneak King,Label of Burger King used for a 2006 advergame promotion.,0
KID,"Tokyo, Japan",1988,Infinity Cure,Defunct in 2006.,0
Kingsoft,"Aachen, Germany",1983,,Acquired by Electronic Arts in 1983; defunct in 2000.,0
King Records,"Tokyo, Japan",1931,Jesus: Ky≈çfu no Bio Monster,No longer publishes video games.,0
Koch Media,Germany,1994,Dead Island,Bought by THQ Nordic February 2018,1
Kodansha,"Tokyo, Japan",1938,Blue Almanac,No longer publishes video games.,0
Koei,"Ashikaga, Tochigi, Japan",1976,Dynasty Warriors,Also a video game developer. Merged into Tecmo Koei.,0
Koei Tecmo,Japan,2009,,Changed name from Tecmo Koei in 2014.,1
Kogado Studio,"Tokyo, Japan",1916,Cosmic Soldier,,1
Konami,"Tokyo, Japan",1969,CastlevaniaMetal GearContraSilent Hill,,1
Krisalis Software,"Rotherham, England, UK",1987,Soccer Kid,Defunct in 2001.,0
KSS,Japan,1990,Majy≈´≈ç,Exited the video game industry in 2001.,0
Kure Software Koubou,Japan,1985,,Also known as KSK.,1
La'cryma,Japan,2006,True Tears,,1
Lankhor,"Paris, France",1987,Mortville Manor,Defunct in 2001.,0
Le Lombard,Belgium,1946,Thorgal: Curse of Atlantis,No longer publishes video games.,0
Legacy Interactive,"Hollywood, California, United States",1998,,Also a video game developer.,1
Legendo Entertainment,"Gothenburg, Sweden",1998,Pure Pinball,Known as Iridon Interactive until 2005.,1
Legend Entertainment,"Chantilly, Virginia, United States",1989,Spellcasting,Acquired by GT Interactive in 1998; defunct in 2004.,0
Lego Interactive,"London, England, UK",1996,Lego Loco,"Publishing arm of Lego Group. Known as Lego Media until 2000, and Lego Software from then until 2002. Defunct in 2005.",0
Leland Corporation,"El Cajon, California, United States",1987,Dragon's Lair II: Time Warp,Renamed to Leland Interactive Media in 1993. Acquired by WMS Industries in 1994.,0
Level-5,"Fukuoka, Japan",1998,Yo-kai Watch,,1
Level 9 Computing,UK,1981,Jewels of Darkness,Defunct in 1991.,0
Linux Game Publishing,"Nottingham, England, UK",2001,,inactive,0
Lighthouse Interactive,"Haarlem, The Netherlands",2005,LocoMania,Acquired by SilverBirch Inc. in 2008; defunct in 2009.,0
LJN,"New York City, United States",1970,,Acquired by Acclaim Entertainment.,0
LK Avalon,"≈öwilcza, Poland",1989,Hans Kloss,,1
Llamasoft,"Wales, UK",1981,Attack of the Mutant Camels,,1
Lock 'n Load Publishing,"Pueblo, Colorado, US",2006,,,1
Logotron Ltd,"Cambridge, England, UK",1987,XOR,Published last game in 1990.,0
Loki Software,"Tustin, California, United States",1998,,,0
Loriciel,France,1983,Jim Power in Mutant Planet,Defunct in 1995.,0
LucasArts,"San Francisco, California, United States",1982,Monkey IslandManiac MansionIndiana JonesStar Wars,Acquired by The Walt Disney Company (originally Lucasfilm Games LLC) and they changed from publisher to licensor.,0
Lump of Sugar,Japan,2005,Nursery Rhyme,,1
MacPlay,"Dallas, Texas, United States",1993,Various Macintosh games,Label of Interplay until 1997. Revived in 2000 as a label of United Developers.,1
MacSoft,"Plymouth, Minnesota, United States",1993,Various Macintosh games,Acquired by Destineer in 2003.,0
Mad Catz,"San Diego, California, United States",1989,MC Groovz Dance Craze,Defunct in 2017.,0
Magical Company,"Kobe, Japan",1985,K≈çshien,No longer publishes video games.,0
Magnavox,"Napa, California, United States",1911,Magnavox Odyssey,Also a video game developer. Acquired by Philips in 1974. Exited the video game industry in 1984.,0
Mr Chip Software,"Chester, UK",1982,Various Commodore 64 games,Ceased publishing video games in 1984; changed name to Magnetic Fields in 1988.,0
magnussoft,"Kesselsdorf, Germany",1984,,,1
Mandarin Software,"Adlington, UK",1988,Lancelot,Publishing label of Europress Software. Last game published in 1990.,0
MangaGamer,Japan,2009,Various visual novels,,0
Martech,"Pevensey Bay, UK",1982,Rex,Ceased publishing video games in 1989.,0
Majesco Entertainment,"Edison, New Jersey, United States",1986,Cooking Mama,Exited the video game industry in 2016.,0
Marvelous,"Tokyo, Japan",2011,,Also a video game developer.,1
Marvelous Entertainment,"Tokyo, Japan",1997,Harvest Moon DS,Merged with AQ Interactive in 2011 to become Marvelous AQL (later Marvelous).,0
Masaya,Japan,1985,Target Earth,"Label of NCS until 2014, and of Extreme since then.",1
Mastertronic,UK,1983,"One Man and His Droid, Master of Magic","Merged with Virgin Interactive in 1988, and subsequently absorbed into Sega in 1991.",0
Mastiff,"San Francisco, California",2002,,Also a video game developer.,1
Matrix Games,"Staten Island, New York, United States",2000,Distant Worlds,Merged into Slitherine Software in 2010 and their games are published by Slitherine.,0
Mattel,"El Segundo, California, United States",1945,Astrosmash,Exited the video game business in 1984.,0
Maximum Games,"Walnut Creek, California, United States",2009,Deer Drive LegendsJASF: Jane's Advanced Strike FightersWorms Collection,Formerly Maximum Family Games,1
Maxis,"Emeryville, California, United States",1987,SimCity seriesThe Sims seriesSpore,Acquired by Electronic Arts and is now its development division. Their games are now published by Electronic Arts or EA Mobile.,0
Max Design,"Schladming, Austria",1991,1869,Defunct in 2004.,0
MC2 France,"Paris, France",2003,Sniper Elite,Currently publishes under the Microids label.,0
MC Lothlorien,UK,1982,Micro Mouse Goes Debugging,Defunct in 1990.,0
MECC,"Brooklyn Center, Minnesota, United States",1973,The Oregon Trail,Defunct in 1999.,0
MediaWorks,"Tokyo, Japan",1992,Emerald Dragon,"Merged with ASCII Corporation in 2008 to become ASCII MediaWorks. In 2009, its game business was merged into Kadokawa Games.",0
Media Factory,"Tokyo, Japan",1986,Derby Stallion 64,"Label of Recruit until 2011, and of Kadokawa Corporation since then. No longer publishes video games.",0
Media Rings,"Tokyo, Japan",1989,Zero4 Champ,Defunct in 2007.,0
Mega Enterprise,"Seoul, South Korea",1998,Call of Duty,Defunct in 2007.,0
Melbourne House,"Melbourne, Australia",1977,Way of the Exploding Fist,Acquired by Krome Studios in 2006; closed in 2010.,0
Meldac,Japan,1990,Zombie Nation,No longer publishes video games.,0
"Metro3D, Inc.","San Jose, California, United States",1998,Dual Blades,Defunct in 2004.,0
Metropolis Software,"Warsaw, Poland",1992,Teenagent,Acquired by CD Projekt in 2008; defunct in 2009.,0
MGM Interactive,United States,1995,Machine Hunter,Software publishing arm of Metro-Goldwyn-Meyer. Defunct in 2005.,0
Microdeal,"St Austell, Cornwall, England, UK",1981,Goldrunner,Rights sold to HiSoft Systems in 1989.,0
Micro√Øds,France,1984,Blacksad: Under the Skin,Also a video game developer. Subsidiary of Anuman.,1
MicroIllusions,"Granada Hills, California, United States",1987,The Faery Tale Adventure,Last game published in 1989.,0
"Micronet co., Ltd.","Sapporo, Japan",1982,Curse,No longer publishes video games.,0
MicroProse,"Hunt Valley, Maryland, United States",1982,X-Com,"Acquired by Hasbro Interactive, name retired.",0
Microsoft,"Redmond, Washington, United States",1975,HaloAge of EmpiresGears of WarBlack & White,Publishes games under the Microsoft Game Studios banner since 2002.,1
Microsphere,"London, England, UK",1982,Skool Daze,Defunct in 1987.,0
Microcabin,Japan,1982,Xak: The Art of Visual Stage,"Acquired by AQ Interactive in 2008, and by Fields Corporation in 2011.",0
Micrografx,"Richardson, Texas, United States",1982,,Acquired by Corel in 2001.,0
MicroGraphic Image,United States,1983,Spelunker,Defunct in 1984.,0
Micro Genius,"Taipei, Taiwan",1989,,Defunct in 1994.,0
Micro Power,"Leeds, England, UK",1980,Castle Quest,Defunct in 1987.,0
Midas Interactive Entertainment,"Braintree, Essex, England, UK",1999,Sanvein,Still sells old games but no longer publishes new games under the name.,0
Midway Games,"Chicago, Illinois, United States",1988,Mortal Kombat,Also a video game developer. Assets acquired by Warner Bros. Interactive and THQ.,0
Midway Manufacturing,"Chicago, Illinois, United States",1958,Spy Hunter,Also a video game developer. Acquired by Bally in 1969; Bally/Midway was in turn acquired by Williams Electronics in 1987. Reformed as Midway Games in 1988.,0
Mikro-Gen,"Bracknell, UK",1981,Pyjamarama,Acquired by Creative Sparks Distribution in 1987.,0
MileStone Inc.,"Tokyo, Japan",2003,Chaos Field,Closed in 2013.,0
Millennium Interactive,"Cambridge, England, UK",1988,Cloud Kingdoms,Acquired by Sony Interactive Entertainment in 1997.,0
Milton Bradley Company,"East Longmeadow, Massachusetts, United States",1860,Time Lord,Acquired by Hasbro in 1984. Defunct in 2009.,0
Minato Soft,Japan,2006,Kimi ga Aruji de Shitsuji ga Ore de,Also publishes under the Whale label.,1
Mindcraft,"Torrance, California, United States",1989,The Magic Candle,Last game published in 1993.,0
Mindscape,"Novato, California, United States",1980,,No longer publishes video games.,0
Minori,Japan,2001,Bittersweet Fools,Software division of CoMixWave until 2007.,0
Mirrorsoft,"London, England, UK",1982,Tetris (Home computers),Acquired by Acclaim Entertainment in 1992.,0
Mitchell Corporation,"Tokyo, Japan",1960,Pang,Defunct in 2012.,0
Mojang,"Stockholm, Sweden",2009,Minecraft,Acquired by Microsoft in 2014.,1
Monolith Productions,"Kirkland, Washington, United States",1994,Get Medieval,Acquired by Warner Bros. in 2004.,0
Monte Cristo,"Paris, France",1995,Cities XL,Defunct in 2010.,0
Moonstone,Japan,2003,Gift,Also publishes under the Moonstone Cherry label.,1
Mosaic Publishing,"London, England, UK",1983,Erik the Viking,Defunct in 1988.,0
MOSS,"Tokyo, Japan",1993,Caladrius,,1
Motown Games,United States,1994,Rap Jam: Volume One,Software publishing arm of Motown. Defunct in 1996.,0
Mountain King Studios,"Chicago, Illinois, United States",1992,DemonStar,No longer publishes video games.,0
MTO,"Yokohama, Japan",1996,GT Pro Series,,1
MTV Games,"New York City, United States",2006,Rock Band,,0
Mud Duck Productions,"Rockville, Maryland, United States",2002,Malice,Label of ZeniMax Media. Defunct in 2007.,0
Muse Software,"Monrovia, Maryland, United States",1978,,Also a video game developer.,0
MumboJumbo,"Dallas, Texas, United States",2001,7 Wonders of the Ancient World,,1
Mystique,United States,1982,Custer's Revenge,Offshoot of Caballero Control Corporation and American Multiple Industries. Defunct in 1983.,0
Namco,"Tokyo, Japan",1955,TekkenPac-ManAce CombatTime Crisis,No longer publishes video games. Video game division merged with Bandai's video game operations as Namco Bandai Games.,0
Natsume Co Ltd,"Tokyo, Japan",1987,Abadox,Renamed to Natsume-Atari in 2013 following merger with subsidiary Atari.,1
Natsume Inc,"Burlingame, California",1988,Harvest Moon,Division of Natsume Co Ltd until 1995.,1
Navel,Japan,2003,Shuffle!,"Label of Omega Vision, Inc.",1
Naxat Soft,"Tokyo, Japan",1988,Recca,Defunct in 2015.,0
NBCUniversal,"Midtown Manhattan, New York City",2004,,The game publishing division will be closed in 2019.[1],0
NCsoft,"Seoul, South Korea",1997,LineageGuild Wars,,1
NEC Corporation,"Tokyo, Japan",1899,Keith Courage in Alpha Zones,Exited the video game industry in 1998.,0
Neko Entertainment,"Montreuil, France",1999,Super Army War,Defunct in 2017.,0
Netdragon,"Fuzhou, China",1997,,Also a video game developer.,1
Netease,"Guangzhou, China",1997,Fantasy Westward Journey,Also a video game developer and online services company.,1
New Generation Software,UK,1982,Trashman,Defunct in 1986.,0
NewKidCo,"Manhattan, New York, United States",1998,E.T.: Interplanetary Mission,Defunct in 2005.,0
New World Computing,"Agoura Hills, California, United States",1984,Might and MagicHeroes of Might and Magic,Also a video game developer. Purchased by 3DO.,0
Nexon,"Seoul, South Korea",1994,Maplestory,Also a video game developer.,1
Nihon Falcom,Japan,1981,Dragon Slayer,,1
Nintendo,"Kyoto, Japan",1889,MarioLegend of ZeldaMetroidPok√©monPikminKirby Animal Crossing,Also a video game developer.,1
Nippon Ichi Software,Japan,1994,Disgaea series,Also a video game developer.,1
Nihon Bussan,Japan,1970,Crazy ClimberTerra Cresta,A.K.A. Nichibutsu,0
Nitroplus,"Tokyo, Japan",2000,Phantom of Inferno,,1
Novagen Software,"Birmingham, England, UK",1983,Mercenary,Defunct in 1992.,0
Nokia,"Espoo, Finland",1865,,,0
