Publisher,Headquarters,Est.,Notable games published,Notes,Active
Nordcurrent,"Vilnius, Lithuania",2002,Minon: Everyday Hero,,1
NovaLogic,"Calabasas, California, United States",1985,Comanche,Acquired by THQ Nordic in 2016.,0
NTDEC,"Taipei, Taiwan",1983,Various unlicensed Famicom games,Defunct in 1993.,0
Nutting Associates,"Mountain View, California, United States",1965,Computer Space,Defunct in 1976.,0
O3 Entertainment,"Santa Clara, California, United States",2001,,,0
Ocean Software,"Manchester, UK",1984,Various licensed Commodore 64 and Amiga games,Acquired by Infogrames,0
Ocean State Publishing,"Woonsocket, Rhode Island, United States",1990,,Label of Rhode Island Soft Systems. Acquired by Freeze.com in 2003.,0
Oculus Studios,"Irvine, California, United States",2014,Asgard's Wrath,Game publishing arm of Oculus VR.,1
Odin Computer Graphics,"Liverpool, England, UK",1985,Nodes of Yesod,"Defunct in 1988, re-established in 2005.",0
Opera Soft,Spain,1986,The Last Mission,Defunct in 1992.,0
Orbital Media,"Calgary, Alberta, Canada",2003,Racing Gears Advance,No longer publishes video games.,0
Origin Systems,"Austin, Texas, United States",1983,UltimaWing Commander,Also a video game developer. Acquired by Electronic Arts.,0
Orion Interactive,United States,1996,,Defunct following acquisition by Metro-Goldwyn-Meyer in 1997.,0
Out of the Park Developments,"Hollern-Twielenfleth, Germany",1999,Out of the Park Baseball,,1
0verflow,"Tokyo, Japan",1997,School Days,,1
Oxygen Games,"Northamptonshire, England, UK",2004,,Also a video game developer.,0
OziSoft,"Sydney, Australia",1982,A Journey to the Centre of the Earth,"Acquired by Infogrames in 1998, and Namco Bandai Games in 2009.",0
Pacific Novelty,United States,1980,The Amazing Adventures of Mr. F. Lea,Last game published in 1983.,0
Pack-In-Video,Japan,1970,Harvest Moon (Japanese release),Acquired by Victor Entertainment in 1996; became Victor Interactive Software.,0
Palace Software,"London, England, UK",1983,"Barbarian: The Ultimate Warrior, Cauldron",Acquired by Titus Software in 1991.,0
Palette,"Tokyo, Japan",2002,Moshimo Ashita ga Hare Naraba,,1
Panasonic,"Osaka, Japan",1918,D,No longer publishes video games.,0
Panda Entertainment,Taiwan,1993,Sango Fighter,Last game published in 1997.,0
Panesian Taiwan,Taiwan,1990,"AV-Pachi Slot, Bubble Bath Babes, Peek-A-Boo Poker",Publisher of eroge for the Family Computer and NES,0
Panther Games,"Canberra, Australia",1985,Fire-Brigade: The Battle for Kiev - 1943,No longer publishes video games. Their games are now published by Lock 'n Load Publishing.,0
Panther Software,Japan,1987,,Last game published in 2004.,0
Paradox Interactive,"Stockholm, Sweden",1998,,Also a video game developer.,1
Paragon Software,"Greensburg, Pennsylvania, United States",1985,The Amazing Spider-Man,Defunct in 1992.,0
Parker Brothers,"Beverly, Massachusetts, United States",1883,Montezuma's Revenge,"Acquired by Hasbro in 1991, which continued to use it as a label on some video games until 1994.",0
Parsoft Interactive,United States,1991,A-10 Attack!,Defunct in 2002.,0
Penguin Software,"Geneva, Illinois, United States",1978,,,0
Pentavision,South Korea,2003,DJMax Portable,Division of Neowiz Games. Merged with GameOn Studios in 2012.,0
Perfect World,"Beijing, China",2004,Perfect WorldJade Dynasty,Also a video game developer. Subsidiaries include Runic Games and Cryptic Studios.,1
Personal Software Services,"Coventry, UK",1981,The Battle For Midway,Acquired by Mirrorsoft in 1987.,0
Petit Ferret,Japan,2002,Popotan,Defunct.,0
Petroglyph Games,"Las Vegas, Nevada, US",2003,Guardians of GraxiaMytheonPanzer General: Russian Assault,Also a video game developer.,1
PF Magic,"San Francisco, California, United States",1991,Petz,Acquired by Ubisoft in 1998.,0
Phantagram,South Korea,1994,Phantom Crash,,1
Philips,"Amsterdam, Netherlands",1891,Various CD-i games,No longer publishes video games.,0
Pionesoft,Japan,2003,After...,Defunct in 2008.,0
Piranha Games,"London, England, UK",1986,The Trap Door,Software publishing arm of Macmillan Publishers Ltd. Defunct in 1988.,0
Piranha Interactive Publishing,"Tempe, Arizona, United States",1995,Morpheus,Defunct in 1999.,0
PlayFirst,"San Francisco, California, United States",2004,Diner Dash,Acquired by Glu mobile in 2014,1
"Playlogic Entertainment, Inc.","The Netherlands, Amsterdam",2002,,,0
Playmates Toys,"Costa Mesa, California, United States",1966,Earthworm Jim (SNES),,0
The PokÈmon Company,"Tokyo, Japan",1998,Pok√©mon Diamond and Pearl,"Joint venture between Game Freak, Nintendo, and Creatures",1
Pony Canyon,"Tokyo, Japan",1966,Dr. Chaos,No longer publishes video games.,0
PopCap Games,"Seattle, Washington, United States",2000,BejeweledPlants vs. ZombiesPeggleZuma,Also a video game developer. Now owned by EA Games.,1
Positech Games,UK,1997,,,1
Presto Studios,"Encinitas, California, United States",1991,The Journeyman Project,Defunct in 2002.,0
PrincessSoft,Japan,2001,,"Publishing label of Oaks Co., Ltd.",0
Prism Leisure Corporation,"Enfield, Middlesex, England, UK",1984,Various ZX Spectrum games,"Also published under the Addictive Games, Endurance Games, and Paxman Promotions labels. Defunct.",0
Private Division,"New York City, New York, US",2017,Kerbal Space Program,Label of Take-Two Interactive,1
Probe Software,"Croydon, England, UK",1984,Mantronix,Acquired by Acclaim Entertainment in 1999; defunct in 2004.,0
Programma International,"Los Angeles, California, United States",1978,3-D Docking Mission,Defunct in 1983.,0
Prototype,"Tokyo, Japan",2006,Planetarian: The Reverie of a Little Planet,,1
Psygnosis,"Liverpool, England, UK",1984,DiscworldLemmings,Also a video game developer.,0
Psikyo,"Kyoto, Japan",1992,Sengoku Blade,Defunct in 2003; continued to be used a label until 2005.,0
Psytronik Software,UK,1993,Knight 'n' Grail,,1
Pulltop,Japan,2002,,,1
Purple Moon,"Mountain View, California, United States",1997,Various girls' video games,Acquired by Mattel in 1999.,0
Purple software,Japan,1985,Haruiro Ouse,Label of JAST. Known as Purple until 1998.,1
Quality Software,"Chatsworth, California, United States",1978,The Return of Heracles,Defunct in 1984.,0
Quantum Axcess,"Columbus, Ohio, United States",1994,Malice,Last game published c. 2003.,0
Quantum Quality Productions,"Flemington, New Jersey, United States",1991,The Perfect General,Acquired by American Laser Games in 1994; defunct in 1995.,0
Quest Corporation,"Tokyo, Japan",1988,Ogre Battle: The March of the Black Queen,Defunct in 2002 following acquisition by Square.,0
Quicksilva,UK,1983,"Ant Attack, Bugaboo (The Flea)","Acquired by Argus Press Software in 1984, which used the Quicksilva name as a label until 1989.",0
QuinRose,Japan,2005,Arabians Lost: The Engagement on Desert,,1
Quintet,"Tokyo, Japan",1987,,Defunct in 2002.,0
Qute,"Sagamihara, Japan",1999,Dicing Knight Period,,1
Q Entertainment,"Tokyo, Japan",2003,Lumines II,,1
R2Games,"Hong Kong, China",2010,,,1
Rabbit Software,"London, England, UK",1982,Potty Painter,Acquired by Virgin Games in 1985.,0
Radica Games,United States,1983,Play TV,Acquired by Mattel in 2006.,0
Rage Software,"Liverpool, England, UK",1992,Striker,Defunct in 2003.,0
Rainbird Software,"London, England, UK",1986,Starglider,"Label of Telecomsoft until 1989, and of MicroProse from then until its discontinuation in 1991.",0
Rainbow Arts,"G√ºtersloh, Germany",1984,"Turrican, The Great Giana Sisters",Also a video game developer. Acquired by Funsoft and subsequently absorbed into THQ in 1999.,0
Rare,"Twycross, England, UK",1985,Jet Force Gemini,Acquired by Microsoft in 2002.,0
Ravensburger Interactive,"Ravensburg, Germany",1883,,Video game subsidiary of Ravensburger AG. Acquired by JoWooD Productions in 2002.,0
Raw Thrills,"Skokie, Illinois, United States",2001,Target: Terror,,1
Red Ant Enterprises,Australia,2001,,Local distributor for other publishers' games. Defunct in 2011.,0
Red Barrels,"Montreal, Quebec, Canada",2011,Outlast series,Also a video game developer.,1
Red Entertainment,"Tokyo, Japan",1976,Gungrave,Known as Red Company until 2000.,0
RedOctane,"Mountain View, California, United States",1999,Guitar Hero,Acquired by Activision in 2006; defunct in 2010.,0
Red Orb Entertainment,"Novato, California, United States",1997,Riven,"Label of Broderbund, and of Mindscape from 1998 onward. Defunct in 2001 following acquisition by Ubisoft.",0
Red Shift,"London, England",1983,Rebelstar Raiders,Defunct in 1985.,0
Red Storm Entertainment,"Cary, North Carolina, United States",1996,Rainbow Six,Also a video game developer. Acquired by Ubisoft and their games are now published by Ubisoft.,0
Regista,Japan,2004,I/O,,1
reLINE Software,"Hanover, Germany",1987,Amegas,Defunct in 2004.,0
Renegade Software,"Wapping, London, England, UK",1991,"Gods, Fire & Ice",Publishing arm of The Bitmap Brothers. Acquired by GT Interactive in 1997.,0
Renovation Products,United States,1990,,Acquired by Sega,0
Richard Shepherd Software,"Slough, Berkshire, England, UK",1982,Shaken but not Stirred,Defunct in 1984.,0
Right Stuff,"Tokyo, Japan",1990,Flash Hiders,Defunct in 1999.,0
Riot Games,"Santa Monica, United States",2006,League of Legends,Also a video game developer. Acquired by Tencent.,1
Ripcord Games,"Santa Clara, California, United States",1996,Postal,Label of Panasonic Interactive Media until 1999. Stopped publishing video games in 2001. Defunct in 2009.,0
Rising Star Games,"Hitchin, England, UK",2004,,,1
Riverhillsoft,Japan,1982,J.B. Harold Murder Club,Defunct in 2004.,0
Rock-Ola,"Chicago, Illinois, United States",1927,Nibbler,No longer publishes video games.,0
Rockstar Games,"New York, New York, United States",1998,Max PayneGrand Theft AutoManhuntMidnight ClubBully,Also a video game developer. Currently a publishing label of Take-Two Interactive.,1
Romstar,"Torrance, California, United States",1984,Twin Cobra,Defunct in 1992.,0
Romtech,"Langhorne, Pennsylvania, United States",1999,,Defunct.,0
Rovio Entertainment,"Espoo, Finland",2003,Angry Birds,Publishers its own developed games as well as 3rd parties under Rovio Stars,1
RTL Group,"Kirchberg, Luxembourg",1920,Crash Time: Autobahn Pursuit,"Published under the RTL Playtainment label. Currently its subsidiary, BroadbandTV, publishes some mobile games.",1
RuneSoft,"T√ºbingen, Germany",2000,Various Linux and Mac OS games,,0
Saga Planets,"Osaka, Japan",1998,Ren'ai CHU!,,1
Sammy Studios,"Minato, Japan",2004,,"Merged with Sega as Sega Sammy Holdings,",1
Samsung,"Seoul, South Korea",1938,Various Sega Mega Drive games in Korea,No longer publishes video games.,0
Sanctuary Woods,"Victoria, British Columbia, Canada",1988,Ripley's Believe It or Not!: The Riddle of Master Lu,Defunct in 2001.,0
"Scavenger, Inc.","Los Angeles, California, United States",1996,Scorcher,Defunct in 1998.,0
Scopely,"Culver City, California, United States",2011,Star Trek Fleet CommandThe Walking Dead: Road to Survival,,1
SCi Games,"London, England, UK",1988,,Bought and merged with Eidos Interactive in 2005. Name retired.,0
SCS Software,"Prague, Czech Republic",1997,Euro Truck Simulator 2,,1
Safari Software,"Houston, Texas, United States",1989,Traffic Department 2192,Acquired by Epic MegaGames in 1997.,0
Scholastic,"Wilkinsburg, Pennsylvania, United States",1920,,Ceased publishing video games in 2007.,0
Sears,"Chicago, Illinois, United States",1886,Various Atari 2600 games,Published under the Tele-Games label. Exited the video game industry in 1983.,0
Sega,"Tokyo, Japan",1960,Sonic the HedgehogPhantasy StarVirtua Fighter,Also a video game developer. Merged with Sammy Studios as Sega Sammy Holdings.,1
Seibu Kaihatsu,"Tokyo, Japan",1982,Raiden,Ceased publishing video games in 1998.,0
SETA Corporation,"Tokyo, Japan",1985,,Defunct in 2009.,0
Shadow Tor Studios,UK,2005,Barrow Hill,,1
Shanda,"Shanghai, China",1999,,Gaming unit spun off as Shanda Games (later Shengqu Games) in 2009.,0
Sharp Corporation,"Sakai, Japan",1912,Nekketsu High School Dodgeball Club: Soccer,No longer publishes video games.,0
Shengqu Games,"Shanghai, China",1999,,,1
Sherston Software,"Sherston, Wiltshire, UK",1983,Various BBC Micro games,Defunct in 2011; now a label of Sherston Publishing Group.,0
Shoeisha,"Tokyo, Japan",1986,BreakThru!,No longer publishes video games.,0
Shogakukan,"Tokyo, Japan",1922,Professor Kageyama's Maths Training: The Hundred Cell Calculation Method,,1
Sierra Entertainment,"California, United States",1979,Gabriel KnightKing's QuestLeisure Suit LarryHalf-LifePolice QuestQuest for GlorySpace Quest,Also a video game developer. Defunct in 2008. Its name was revived as Activision's brand in 2014.,0
Silicon Beach Software,"San Diego, California, United States",1984,Enchanted Scepters,Acquired by Aldus in 1990.,0
Silmarils,"Lognes, Paris, France",1987,Metal Mutant,Defunct in 2003.,0
Simon & Schuster Interactive,"New York City, United States",1995,Deer Avenger,Defunct in 2003.,0
"SIMS Co., Ltd.","Tokyo, Japan",1991,Vay,,1
Simulations Canada,Canada,1977,Various computer wargames,No longer publishes video games.,0
Sinclair Research Ltd.,"London, England, UK",1973,1K ZX Chess,"Brand name sold to Amstrad in 1985, which continued to use it as a label until 1992.",0
Sirius Software,"Sacramento, California, United States",1980,Wayout,Defunct in 1984.,0
Sir-Tech,"New York City, United States",1979,Wizardry,Defunct in 2003.,0
Slitherine,"Epsom, Surrey, UK",2000,Panzer CorpsDistant Worlds,"Publisher of strategy and wargames on PC, Mac, mobile and home consoles.",1
SNK,"Osaka, Japan",2001,Ikari WarriorsFatal FuryWorld HeroesSamurai ShowdownArt of Fighting,Acquired by 37Games in 2015,1
Soedesco,"Rotterdam, The Netherlands",2001,Various indie games,,0
SOFEL,"Tokyo, Japan",1979,Wall Street Kid,No longer publishes video games.,0
Soft-World,"Taipei, Taiwan",1983,Heroes of Jin Yong,,1
Softape,United States,1978,Various Apple II games,Defunct in 1983.,0
Softdisk,"Shreveport, Louisiana, United States",1981,Catacomb 3-D,Defunct in 2016.,0
SoftKey,United States,1978,Oregon Trail II,"Known as Micro International Corp. until 1989, and as WordStar International Inc. until 1994. Changed name to The Learning Company in 1996; continued to use the SoftKey label on some software until 1999, when the company was acquired by Mattel.",0
Softek International Ltd,"London, England, UK",1980,Quo Vadis,Defunct in 1989. Published some games under the label The Edge.,0
SoftSide,United States,1978,Arena of Octos,Defunct in 1984.,0
Softstar,"Taipei, Taiwan",1988,The Legend of Sword and Fairy,,1
Software 2000,"Eutin, Germany",1987,Fast Food Tycoon,Defunct in 2002.,0
Software Dynamics,"Victoria, British Columbia, Canada",1987,Operation: Inner Space,,1
Software Projects,"Liverpool, England, UK",1983,Jet Set Willy,Defunct in 1985.,0
Sony Imagesoft,"Los Angeles, California, United States",1989,Super Dodge Ball,Initially known as CSG Imagesoft. Defunct in 1995.,0
Sony Interactive Entertainment,"San Mateo, California, United States",1993,Ratchet & ClankJak and DaxterGod of WarKillzoneUnchartedResistance,,1
Sony Pictures Digital,"California, United States",1997,,Publisher of mobile phone games.,1
SouthPeak Games,"Virginia, United States",1996,Two Worlds,,0
Spectral Associates,"Tacoma, Washington, United States",1980,Various TRS-80 Color Computer games,Published last game in 1988.,0
Spectravideo,United States,1981,Mangia,Published Atari 2600 games under the label Spectravision. Defunct in 1988.,0
Spectrum HoloByte,"Alameda, California, United States",1983,,Also a video game developer. Acquired by Hasbro Interactive.,0
Spike,"Tokyo, Japan",1991,Michigan: Report from Hell,Merged with Chunsoft in 2012.,0
Spil Games,"Hilversum, The Netherlands",2001,,Also a video game developer.,1
Spinnaker Software,"Cambridge, Massachusetts, United States",1982,In Search of the Most Amazing Thing,Acquired by The Learning Company in 1994.,0
Square,"Tokyo, Japan",1986,Final Fantasy,Also a video game developer. Merged with Enix to create Square Enix.,0
Square Electronic Arts,"Costa Mesa, California, United States",1998,Parasite Eve,Owned by Square and Electronic Arts. Folded back into Square and changed to Square Enix.,0
Square Enix,"Tokyo, Japan",1975,Dragon Quest,,1
Square Enix Europe,"London, England, UK",1990,Tomb RaiderHitmanThief,"Also a video game developer. Acquired by SCi Games in 2005, then by Square Enix in 2009. Formerly known as Eidos Interactive until 2009.",1
Stardock,"Livonia, Michigan, United States",1991,Sins of a Solar EmpireGalactic Civilizations,Also a video game developer.,1
Starpath,"Livermore, California, United States",1981,Escape from the Mindmaster,Defunct in 1984.,0
Stern Electronics,"Chicago, Illinois, United States",1977,Berzerk,Ceased video game production in 1985.,0
Sting Entertainment,"Tokyo, Japan",1989,Last Battalion,,1
Storm Impact,"Glenview, Illinois, United States",1989,TaskMaker,Defunct in 1997.,0
Strategic Simulations (SSI),"Sunnyvale, California, United States",1979,,"Also a video game developer Acquired by Ubisoft, name retired.",0
Strategic Studies Group,Australia,1983,Reach for the Stars,No longer publishes video games. Their games are now published by Matrix Games.,0
Stormfront Studios,"San Rafael, California, United States",1988,Old Time Baseball,Defunct in 2008.,0
Strategy First,"Montreal, Quebec, Canada",1988,Europa Universalis,,1
Studio e.go!,"Osaka, Japan",1998,Castle Fantasia: Seima Taisen,Defunct in 2009.,0
subLOGIC,"Urbana-Champaign, Illinois, United States",1975,Flight Simulator,Acquired by Sierra in 1995.,0
Success,"Tokyo, Japan",1978,,Also a video game developer.,1
Sunflowers Interactive Entertainment Software,"Heusenstamm, Germany",1993,Anno 1602,Acquired by Ubisoft in 2007.,0
Sunrise Interactive,Japan,1998,Mai-HiME: Unmei no Keit≈çju,Defunct in 2008.,0
Sunsoft,"Aichi, Japan",1981,Aero the Acro-Bat,"Closed U.S. offices, operates out of Japan.",1
Superior Software,"Leeds, England, UK",1982,Citadel,,1
Supersoft,"Harrow, London, UK",1978,Air Attack,Ceased publishing video games in 1985.,0
Sydney Development Corporation,"Vancouver, British Columbia, Canada",1978,,Defunct in 1989.,0
Super Fighter Team,"San Diego, California, United States",2004,Legend of Wukong,,1
Suzy Soft,"Zagreb, Croatia",1985,Various ZX Spectrum and Commodore 64 games,Software division of Suzy Records. Defunct in 1988.,0
Synapse Software,"Richmond, California",1981,Blue Max,Purchased by Broderbund in 1984. Defunct in 1986.,0
Synergistic Software,"Seattle, Washington, United States",1978,Odyssey: The Compleat Apventure,Acquired by Sierra in 1996; defunct in 1999.,0
SystemSoft,Japan,1985,Daisenryaku,No longer publishes video games.,0
System 3,"London, England, UK",1982,"The Last Ninja, International Karate, Myth: History in the Making",Also a video game developer.,1
System Sacom,"Tokyo, Japan",1981,,No longer publishes video games.,0
Tactics,Japan,1997,One: Kagayaku Kisetsu e,"Acquired by Nexton in 1999, which has continued to use the Tactics brand on some games.",0
Taito,"Tokyo, Japan",1953,Bubble Bobble,Also a video game developer. Acquired by Square Enix.,1
Takara,Japan,1955,The Transformers: Mystery of Convoy,Merged with Tomy in 2006.,0
Take-Two Interactive,"New York, New York, United States",1993,,"Also owns publishers Rockstar Games, 2K Games (2K Sports), and Private Division. Also a video game developer.",1
TalonSoft,"Baltimore, Maryland, United States",1995,Battleground,"Also a video game developer. Acquired by Take-Two Interactive, name retired.",0
Tamsoft,"Tokyo, Japan",1992,Guardian's Crusade,,1
Tandy Corporation,"Fort Worth, Texas, United States",1919,Microchess,Ceased publishing games in 1989.,0
Taxan,Japan,1981,,No longer publishes video games.,0
TDK Mediactive,"Westlake Village, California, United States",1990,Lady Sia,American software publishing arm of TDK. Defunct in 2003.,0
Team17,"Wakefield, England, UK",1990,"Worms, Alien Breed, Superfrog, Yooka-Laylee",Also a video game developer.,1
Team Shanghai Alice,Japan,1996,Touhou Project,,1
Techland,"Ostr√≥w Wielkopolski, Poland",1991,,,1
Technical Group Laboratory,"Osaka, Japan",1984,,Also known as TGL.,1
Technology and Entertainment Software,Japan,1982,Hydlide,Also known as T&E Soft. Ceased publishing video games in 2002.,0
Technosoft,"Sasebo, Nagasaki, Japan",1980,Thunder Force,Acquired by Twenty-one Company in 2001.,0
Technos Japan,"Tokyo, Japan",1981,,Also a video game developer. Assets acquired by Atlus.,0
TecMagik,"California, United States",1991,,Also a video game developer.,0
Tecmo,Japan,1967,Ninja GaidenTecmo BowlDead or Alive,Merged into Tecmo Koei.,0
Tectoy,"Sao Paulo, Brazil",1987,Many games for Sega consoles in Brazil.,,1
Telarium,"Cambridge, Massachusetts, United States",1984,Fahrenheit 451,Defunct in 1987.,0
Telesys,"Fremont, California, United States",1982,Fast Food,Defunct in 1984.,0
Telenet Japan,Japan,1983,Valis: The Fantasm Soldier,Defunct in 2007.,0
Telltale Games,"San Rafael, California, United States",2004,,Defunct in 2018.,0
Tencent,"Shenzhen, China",1998,,Also a video game developer and online services company. Has a minority stake in Epic Games and owns Riot Games as a subsidiary.,1
Tengen,"Milpitas, California, United States",1987,Tetris,Publishing arm of Atari Games. Defunct in 1994 following acquisition by Time Warner.,0
Texas Instruments,"Dallas, Texas, United States",1930,Parsec,Exited the video game industry in 1984.,0
Thalamus Ltd,"London, England, UK",1986,Armalyte,Defunct in 1993.,0
Thalion Software,"G√ºtersloh, Germany",1988,Amberstar,Defunct in 1994.,0
The9,"Shanghai, China",1999,,Former regional publisher for World of Warcraft in China,1
The Learning Company,"San Francisco, California, United States",1980,,"Merged with Mattel Interactive, no longer publishes video games",0
Thin Chen Enterprise,"Taipei, Taiwan",1988,Colorful Dragon,"Also used the labels Sachen, Commin, and Joy Van. Defunct.",0
Thinking Rabbit,"Takarazuka, Japan",1982,Sokoban,Defunct.,0
THQ,"Agoura Hills, California, United States",1989,Red FactionS.T.A.L.K.E.R.: Shadow of ChernobylSaint's RowTak and the Power of JujuDestroy All Humans!,"Also a video game developer. Nordic Games (now THQ Nordic) revived the THQ brand in 2016, and all THQ franchises folded to THQ Nordic.",0
THQ Nordic,Austria,2011,,"Purchased Darksiders, Red Faction, and MX vs. ATV franchises from THQ, Previously called Nordic Games from 2011‚Äì2016.",1
Thorn EMI Computer Software,"London, England, UK",1981,River Rescue,Software publishing arm of Thorn EMI. Spun off and reestablished as Creative Sparks in 1984.,0
Three-Sixty Pacific,United States,1987,Dark Castle,Defunct in 1994.,0
Tiertex Design Studios,"Manchester, UK",1987,Ace of Aces,Last game published in 2003.,0
Tiger Electronics,"Vernon Hills, Illinois, United States",1978,Various LCD games and Game.com games,Also a video game developer. Acquired by Hasbro in 1998.,0
Time Warner Interactive,"Milpitas, California, United States",1993,Primal Rage,Merged into Midway Games West in 1996.,0
Titus Interactive,France,1985,,,0
Toaplan,Japan,1984,Fire Shark,Defunct in 1994.,0
Toei Animation,"Tokyo, Japan",1956,Baltron,,1
Toho,"Tokyo, Japan",1932,Godzilla: Monster of Monsters,No longer publishes video games.,0
Tokuma Shoten,"Tokyo, Japan",1954,Incredible Crisis,No longer publishes video games.,0
Tokyo Shoseki,"Tokyo, Japan",1909,Cycle Race: Road Man,No longer publishes video games.,0
Tomy (Takara Tomy),"Tokyo, Japan",1924,Pretty Rhythm,Merged with Takara in 2006.,1
Tommo,"City of Industry, California",1990,Monster Rancher DS,,1
Tonkin House,"Tokyo, Japan",1986,Gun-Nac,Defunct in 2008.,0
Topologika,"Stilton, UK",1983,Countdown to Doom,Defunct in 2013.,0
Topo Soft,Spain,1987,Survivor,Defunct in 1994.,0
TopWare Interactive,"Karlsruhe, Germany",1995,,"Also a video game developer. After filing for bankruptcy in 2001, it was acquired by Zuxxez Entertainment, and later resurrected in 2005. Filed for bankruptcy again in 2016, but continues to publish future video games.",1
Toshiba EMI,"Tokyo, Japan",1960,Syvalion,Defunct in 2013.,0
Towa Chiki,"Tokyo, Japan",1986,A Week of Garfield,Defunct in 2001.,0
Tradewest,"Corsicana, Texas, United States",1986,,"Acquired by Midway Games, name retired.",0
Treco,"Torrance, California",1990,Atomic Robo-Kid,Defunct in 1993.,0
Triangle Service,"Tokyo, Japan",2002,Trizeal,,1
Triffix Entertainment,"Montreal, Quebec, Canada",1991,CastelianDream TVSpace Football: One on One,Last game published in 1992.,0
Trilobyte Software,"Medford, Oregon, United States",1990,Uncle Henry's Playhouse,"Defunct in 1999, re-established in 2010.",1
Tripwire Interactive,"Roswell, Georgia, United States",2005,Killing Floor,,1
Tri Synergy,"Dallas, Texas, United States",1996,,,1
Tru Blu Entertainment,"Sydney, Australia",1999,Rugby League,,0
Tsunami Games,"Oakhurst, California, United States",1991,Blue Force,Sold to Tsunami Media Corporation in 1999.,0
TT Games,"Maidenhead, England, UK",2005,,Also a video game developer. Merger of Giant Interactive Entertainment and Traveller's Tales. Acquired by Warner Bros. Interactive.,1
Twilight Frontier,Japan,2002,Higurashi Daybreak,,1
Tynesoft,"Blaydon, UK",1983,Superman: The Man of Steel,Exited the video game industry in 1991.,0
Type-Moon,Japan,2000,Tsukihime,,1
Ubisoft,"Montreuil-sous-Bois, France",1986,RaymanAssassin's CreedFar CryGhost ReconSplinter Cell,Also a video game developer.,1
UEP Systems,"Tokyo, Japan",1985,Cool Boarders,Defunct in 2001.,0
UFO Interactive Games,"City of Industry, California",1999,Monster Rancher DS,Label of Tommo.,1
Ultimate Play the Game,"Ashby-de-la-Zouch, UK",1982,"Jetpac, Knight Lore","Acquired by U.S. Gold in 1985, which continued to use the Ultimate name as a label on some games. Defunct in 1988.",0
Ultrasoft,"Bratislava, Slovakia",1989,Towdie,Defunct in 1998.,0
Ultra Games,"Buffalo Grove, Illinois, United States",1988,,Shell company and publishing label for Konami. Name retired in 1992.,0
United States Army,"Arlington, Virginia, United States",1775,America's Army,,1
Universal Entertainment Corporation,Japan,1969,Mr. Do!,,0
