Publisher,Headquarters,Est.,Notable games published,Notes,Active
U.S. Gold,"Birmingham, England, UK",1984,,Also a video game developer. Acquired by Eidos Interactive.,0
UserJoy Technology,Taiwan,1995,The Legend of Three Kingdoms,,1
US Games,"Santa Clara, California, United States",1978,Entombed,Acquired by Quaker Oats in 1982. Defunct in 1983.,0
Valcon Games,"Bellevue, Washington, United States",2005,Darkest of Days,No longer active.,0
Valve,"Bellevue, Washington, United States",1996,Half-Life seriesCounter-Strike seriesPortal seriesLeft 4 Dead seriesDota 2,Also a video game developer.,1
VAP,"Tokyo, Japan",1981,Isolated Warrior,No longer publishes video games.,0
Varie,Japan,1986,Parallel World,Defunct in 1997.,0
VEB Polytechnik,"Chemnitz, Germany",1870,Poly Play,Defunct in 2006.,0
Vectorbeam,"California, United States",1978,Speed Freak,Acquired by Cinematronics in 1980.,0
Viacom,"New York City, United States",1952,Phantom 2040,Published video games under the Viacom New Media label. Company split in 2005.,0
Victor Interactive,Japan,1970,Shadow of the Beast,Subsidiary of JVC. Merged with Pack-In-Video in 1996. Acquired by Marvelous Entertainment in 2003; defunct in 2007.,0
Vic Tokai,"Shizuoka, Japan",1977,,No longer publishes video games.,0
Virgin Interactive,"London, England, UK",1983,Global Gladiators,"Also a video game developer. Known as Virgin Games until 1993. American branch acquired and closed by Electronic Arts in 1998, European branch acquired by Titus Software in 1999, and re-branded to Avalon Interactive in 2003. Stopped publishing games after 2002.",0
Virgin Play,Spain,1995,Touch the Dead,Known as Virgin Interactive Espana SA until 2002. Filed for liquidation in 2009.,0
Virtual Programming,"Bournemouth, UK",2000,Various Mac OS games,,1
Visco Corporation,Japan,1982,Wardner,No longer publishes video games.,0
The Vision Factory,"Den Bosch, The Netherlands",1993,Various CD-i games,Defunct in 2002.,0
VisualArt's,"Osaka, Japan",1991,Kanon,,1
Vivarium Inc.,"Tokyo, Japan",1993,SimTower,"Previously known as OPeNBooK Co., Ltd.",0
Vivendi Games,"Los Angeles, California United States",1993,,Merged with Activision to form Activision Blizzard in 2008.,0
Vortex Software,"Manchester, UK",1981,Highway Encounter,Defunct in 1990.,0
VoxelStorm,"Manchester, UK",2012,AdvertCity,Also a video game developer and music publisher.,1
Vulcan Software,"Cotswolds, UK",1994,Valhalla: Before the War,,1
Wales Interactive,"Bridgend, Wales, UK",2012,The BunkerSoul Axiom,Also a video game developer.,1
Walnut Creek CDROM,"Walnut Creek, California, United States",1991,Various shareware CD-ROMs,Merged with Berkeley Software Design in 2000.,0
Wanadoo Edition,"Paris, France",2000,Iron Storm,Software publishing arm of Wanadoo. Defunct in 2003.,0
Warashi,"Tokyo, Japan",1995,Triggerheart Exelica,,1
Wargaming,"Nicosia, Cyprus",1998,World of TanksWorld of WarplanesWorld of Warships,Also a video game developer.,1
Warner Bros. Interactive,"Burbank, California, United States",1993,F.E.A.R. 2Overlord,,1
WARP,Japan,1994,Enemy Zero,"Exited the video game industry in 1999, defunct in 2005.",0
Webfoot Technologies,"Lemont, Illinois, United States",1993,Deadly Rooms of Death,,1
Webzen,"Seoul, South Korea",2000,,Also a video game developer.,1
WildTangent,"Redmond, Washington, United States",1998,Fate: The Traitor Soul,,1
Williams Electronics,"Chicago, Illinois, United States",1943,"Robotron 2084, Defender",Exited the video game industry in 1998.,0
Windham Classics,"Cambridge, Massachusetts, United States",1984,Below the Root,Published last game in 1985.,0
Windmill,Japan,2002,Happiness!,Publishes under the Windmill Oasis label.,1
Windmill Software,"Toronto, Ontario, Canada",1982,Digger,Defunct in 1984.,0
Winkysoft,"Osaka, Japan",1983,,Defunct in 2015.,0
Wisdom Tree,"Tucson, Arizona, United States",1989,,Known for Christian-themed games.,1
WizardWorks,"Minneapolis, Minnesota, United States",1990,Deer Hunter,Acquired by GT Interactive in 1996. Defunct in 2004.,0
Wolf Team,"Tokyo, Japan",1986,Annet Futatabi,Acquired by Namco in 2003.,0
Working Designs,"Redding, California, United States",1986,Lunar,Specialized in the localization of Japan-native RPGs.,0
Xicat Interactive,"Fort Lauderdale, Florida, United States",1997,,Defunct in 2005.,0
Xonox,"Minnesota, United States",1983,Artillery Duel,Defunct in 1984.,0
XSEED Games,"Torrance, California, United States",2005,Ys Seven,,1
XS Games,"New York, New York, United States",2002,,,0
Yeti,Japan,2005,Root Double: Before Crime * After Days,,1
Yojigen,Japan,1994,WildSnake,Defunct.,0
Yonezawa PR21,Japan,1988,Battle Storm,Also known as Party Room 21. Acquired by Sega in 1994; defunct in 1998.,0
Yuke's,"Osaka, Japan",1993,Evil Zone,,1
Yutaka,Japan,1990,Last Armageddon,Defunct in 2003 following merger with Popy.,0
Zaccaria,"Bologna, Italy",1974,Various arcade games,Defunct in 1988.,0
ZAPiT Games,"Mississauga, Ontario, Canada",2003,Game Wave Family Entertainment System,Defunct.,0
ZeniMax Media,United States,1999,Elder Scrolls,Also owns publisher Bethesda Softworks.,1
Zenobi,"Rochdale, UK",1982,Various text adventure games,,1
Zeppelin Games,"Gateshead, UK",1987,Draconus,"Acquired by Merit Studios Inc. in 1994 and renamed to Merit Studios Europe. Subsequently, regained independence in 1996 and reestablished itself as Eutechnyx. No longer publishes its own games.",0
Zigurat,Spain,1986,Various ZX Spectrum games,Published last game in 1992.,0
Zimag,United States,1982,Dishaster,Publishing label of Magnetic Tape International. Defunct in 1983.,0
Zoom,"Sapporo, Japan",1988,Overtake,,1
Zuxxez Entertainment,"Karlsruhe, Germany",2001,,Acquired TopWare Interactive in 2001. Renamed itself to TopWare Interactive in 2005. Name retired.,0
Zushi Games,"Sheffield, England, UK",1999,,,0
Zynga,"San Francisco, California",2007,FarmVilleMafia Wars,,1
ZyX,Japan,1994,,,1
